,title + body
5282,"Rather than looking at the shareholders with sputum, I would rather stop drinking cacao."
5283,I'm going to make a quick stop and wait for Zaharo to the basement
5284,I was bitten by a foreigner. It was originally bitten. I think it will be full again.
5285,Cherokee’s Jewish financial capital is saying em hahahahahahahahahahahahahahahahahahahahaha
5286,"Kakao is far superior to Naver. Sales of Kakao are similar. Don't worry because listed subsidiaries provide strong support for Kakao. On the other hand, Naver is completely absurd."
5287,I think I'll have to wait at least a year. I'm going to dive.
5288,Last year’s thousand-dollars are monjirel
5289,There is no way for the after-hours closing price to plummet
5290,I'm crying
5291,Tomorrow's upside angle Nastock rise Foreign buying technical rebound
5292,"I was forced to buy cacao, but the one I was talking about was bought, but tomorrow it will skyrocket"
5293,"It's the price of almost a year ago, it's a lost year"
5294,Is there no Black Friday?
5295,"Heo Guheon Day, the Korean stock market"
5296,"The Financial Supervisory Service investigated the institutions and bought Line Bus Maedong Boni Exchange Inverse Exchange Gob Bus Kosdaq Inverse Setda Institutions alone, especially Gob Bus, a whopping 10 million shares in recent female trading days alone. It's like a forced ant credit stealing operation. There is a reason why the economy TV is acting so viciously. Even at the end of the month, there was a time when credit decreased by hundreds of billions of dollars a day. It was very vicious at the end of the month and the beginning of the month. The FSS finds the relevant institutions and investigates them. Do not delay the investigation and do it very publicly. Investigate and give a disadvantage even if there is no problem. I checked the exchange and KOSDAQ leverage as well, and the same is true for the month of the month and the beginning of the month."
5297,"am the stock king who sheds tears, Dana is the stock emperor who sheds tears, and tells the story of the success story of Boram Investment Plaza Chairman Woo Young-doo, who became the main character of paying billions of billions in stock capital gains tax from poor credit. He wanted to improve the quality of life by conveying the wisdom, blessings and hopes he shared with his acquaintances from the sky he received help to to those who are in dire need. Let's meet the reality of the global financial structure and the fight between individuals and companies in the clogged stock market"
5298,ㅎㅇㅋ The atmosphere here is also giblets. Give me a recommendation for samjeon or cacao.
5299,"Yoon Seok-Yeol Risk Seeing that outsiders are leaving our stock market, Yoon Seok-Yeol Risk I put it in a developed country as if I had foreseen it, but it will become a developing country again. Leaving the Blue House in perfect condition until the right time, doing government shopping before the office and taking a walk around the dog."
5300, Yoo Young Doo Elliot
5301,"View Woong Scenes Gathering Sona How long have you been bitten, can’t sleep, can’t eat rice, don’t have money to spend Who is this?"
5302,"Do you want to make money with stocks? The process of becoming trash, a normal person, starting introductory stocks, making money from stocks around the beginning of the stock market Changed to top-bitten account halved over male stock market scare Knowing and studying Futures Overseas stock market glances Early profit spring now Loan to make up for loss Lever inverse ship Stock gathering Coin box Bit truna Knockdown Account over loss Tesla Looking at the same chart, I’m sure I’ll keep selling and holding on to the same chart, even though it’s only a few profits, I go around the discussion room every night, and I go to the lower and lower charts and play with experts, recruiting people, pretending to be experts, setting up notifications, pretending to be experts, setting up alarms, making a living while working part-time, earning pocket money Minimum hourly wage"
5303,Kakao Balance Quantity Based on today's stock
5304,"Until the first half of last year, the blast must have been a dream"
5305,"Be strong, Super Powell"
5306,"ㅋ When I narrowed the chart, I drew a landscape painting with high peaks and deep valleys."
5307,Why are you making people so disgusting that the US should dismantle nuclear weapons while letting others not make it? Complete idiots
5308,"Lee Sang Investment Group's stock leadership is a scam Don't be scammed like me In the booming period, they falsely advertise that profits are guaranteed by performance, but when you look at it in reality, they do not have enough skills and it is difficult to lose money at the peak. You entice ants with false advertisements. After recruiting members, if the contract period is over half, you will lose the member, so take care of it. The more expensive the member, the worse. Please do not go to hell after signing up."
5309,"Hey, I hope I'll fall today too, fall off"
5310,Employees are blah blah blah blah blah blah blah blah blah blah blah blah blah blah blah
5311,"Today, from the beginning of the feeling, the blue flowers have bloomed in full bloom. The wind is blowing in a downward trend all day. The closing is also the lower limit."
5312,"Recession is coming - The answer is to throw it now, even if it's sluggish for years"
5313,"If Christmas falls on Saturday or Sunday, please designate Monday as a substitute holiday"
5314,"If you get hit in the back once, you won't do it again, be careful"
5315,"If you get hit in the back once, you won't do it again, be careful"
5316,"Condolences came, I'm going to eat a lot of yukgaejang today too ㅋ I'm a little girl in the Han River Haha I'll eat a bowl of meat and makgeolli to my heart's content."
5317,"Company executives who only talk about the future, new technology, mobile, etc. A company that only talks and jokes about stocks You have no right to discuss future technology with the company."
5318,Is Netflix Bad or Cacao Bad?
5319,"Large-cap fair value Samsung Electronics KRW 10,000 LG Electronics KRW 10,000 Hynix KRW 10,000 LG Ensol KRW 10,000 Naver KRW 10,000 Kakao KRW Samsung KRW 10,000 LG Chemical KRW 10,000 Hyundai Motor KRW 10,000 Kia Motor KRW 10,000 Celltrion KRW 10,000 Hanmi Pharmaceutical KRW 10,000 Shinhan Holdings KRW 10,000 Hana Financial Group KRW 10,000 Samsung Life KRW 10,000 Samsung Fire KRW 10,000 Samsung SDS 10,000 won Korea Electric Power 10,000 won 10,000 won Telecom 10,000 won U Plus 10,000 won This is the price I've been shouting since last year"
5320,"Today as always, it is a formula for missing gifts."
5321,What do you have to say about the Jewish money?
5322,Measures to be taken in public auction are needed. Government measures are urgently needed.
5323,finally kaka
5324,"I'm so happy to be president Yoon, please blow the stock bubble. Let's buy a stock too."
5325,This is a summary of the interpretation of the remarks of the Powell hearing.
5326,Kakao price surges before opening and goes down to Fake Nevada Evidence of mischief
5327,Today's closing price forecast
5328,"Before the upturn, I will go after a terrible fear drop soon"
5329,"surge in counter-trading is fueling the downtrend Investments made by individual investors in debt are fueling the stock market decline According to the Il Financial Investment Association, the daily average counter trading volume has recently exceeded 100 million won, showing a high level. This was the highest figure since last year. It was almost twice the daily average counter trades of 100 million won last year. In a situation where the stock market is showing great volatility, it is an analysis that a vicious cycle is appearing in which the stock price declines further as items for sale that did not pay off money or sell the stock in advance come to the market as a counter sale. It is structured to borrow money from a securities company to buy stocks and repay the money, but if the payment is not made within the trading day, a reverse transaction is made. According to the researcher, the number of counter-trading increases as the stock price declines continuously, and it is estimated that a vicious cycle occurs when the decline intensifies. The analysis explained that the increase in stock purchases through credit in the process of the stock price surge in the year when the Donghak ant craze blew after the novel coronavirus infection corona is acting as a burden in the process of the stock price decline. The stock price surged after the stock price plunged, so it is still at a high level compared to the pre-COVID level, both in absolute terms and relative to the market capitalization. As of the last day, the credit balance recorded a total of 100 billion won, including KRW trillion in the KOSPI and KRW trillion in the KOSDAQ. Analysts analyzed that the lack of incentives to buy at the trough and the increased selling pressure, including counter-trading, estimated that individual investors would have lost more than the current index after investing through credit loans. Researcher Choi said that it is possible that the inflows have been repaid before, but it is clear that the amount of inflows near the peak of the index is significant. If it occurs, he explained that there is a possibility that it will face a downtrend that exceeds the extent of fundamental damage due to selling pressure. The enormous amount of less than a trillion and a half is the amount that individual investors are estimated to have lost more than the current index after investing with credit loans."
5330,Buy a lot today and get rich ㅋㅋ I'm sorry
5331,"If it had risen at the rate that cacao fell these days, if it had risen at this rate, it would have gone to the date of signing and suspension of trading every minute in the investment caution stocks"
5332,It's sold out and only the bones are left. The market cap is two keke. The price of the bones looks reasonable.
5333,The desire to reduce the number of employees and buy billions of stocks is really too much. Is it even a dividend?
5334,"If I had heard the anti-Kakao opinions, I wouldn't have come this far, but the real Kagao anti-Kakao people are the ones who turn to hope."
5335,"Even today, when it goes down, it’s scary, when it goes up, it’s won"
5336,It's really disgusting. Are you missing out today? What the hell are you going to do?
5337,Replying to @James_Girls
5338,"Today's movement, why is this the last resistance?"
5339,It seems that the goal is to converge on the determination that it is impossible to raise even one hundred won.
5340,I'm envious of the soaring celebration
5341,Did you know that Kakao CEOs and executives were sold?
5342,"I've seen the Nakdong River defense line, but it seems like it will end up in the Touligo floor"
5343,I am a newcomer who is planning to move in. Thank you very much.
5344,It's really evil. Set a deadline for repayment of short selling.
5345,let's die together
5346,"Let's go to market cap Let's go market cap Thank you, President Jo Yoon"
5347,"When asked about the Yoon Moo-sik economy that Yoon Moo-sik puts on as if scratching people's backs and uses it every day without knowing it, it's because of a criminal in the election, it's because of the Democratic Party. Ah, the economy is like this, I'm asking how we're going to deal with it. Be the king. Oh, Namolang Putin Xi Jinping Biden will take care of it. I'm going to play with our dogs and watch a movie. The world economy is not good, so there is nothing we can do about it."
5348,Let's take a look at the world's cash vending machines
5349,"Oh my gosh, you're just half-tok"
5350,"The KOSPI has been falling since a year ago, but the reason for not seeing Wolbong is that Moon Jae-in urged him to invest in many stocks, and the resumption of Moon Jae-in's short selling also seems to have no stocks led by the instigators of Moon Jae-in's political disease."
5351,"Is there a floor? I got off the floor with tears in my eyes, but a blessing"
5352,"The support line is broken. The last line is broken. I'll hold on to the present a little bit, and then I'll go to the first half of the year. Now I have no money and my patience is limited."
5353,"Kakao's subsidiary was listed and all the ant shareholders were cut in pieces. It's great, Beomsu. Is this the win-win and fairness you're talking about?"
5354,"You really are a huge scammer organization. You list everything that makes money, sell it at a high price, and run out of money for the ants. You have a friendly image in front of the character. Kakao-related stocks are banal. Even though your family is ruined, you are still friendly with the image of a national app. They say they change the representative and get the minimum wage"
5355,Replying to @James_Channel
5356,"I can't stop swearing already, Chin, I have to go down. What's the president like?"
5357,"It's not the current government's fault for the stock market and economic situation right now, more than half of the national policy is to defend the stock economy market. Jerome Powell is crazy and will brief you on the step-by-step economic stimulus plan and future plans for a week away. is the only country in the world that has not announced any measures related to the economic crisis among major countries in the world, so only the funds of the country are running out day and night. Yoon-man economy should be left to the private sector, and there is no announcement of measures. Is this normal? And the best measures implemented during the Lee Myung-bak administration failed and eventually led to an economic recession. What the hell do you have to doubt me about is a policy, and why is it that the president is the first to know about previous failures? What do you know?"
5358,"Save me, let's save cacao"
5359,"It's over when we spray here, as we've already predicted"
5360,"It's a highway, it's just falling down"
5361,let's go
5362,"Every other week, I'm addicted to having fun lol I listed the stocks so my employees are full and the shareholders are killing me ㅋㅋ"
5363," The floor is so low, why can't it go down?"
5364,"Is this stock? Gaekaogaekao executives, talk to me"
5365,"Even if it's scary, I do it too much, I've invested for years, but it's the first time I've ever seen a pine nut like this during the years of investing."
5366,"Foreign buying is coming. Now, institutions will start buying soon. It's almost half the price compared to the highest price."
5367,"I hope the circle won't break, I hope hehe"
5368,"Today, I go to hell, khao cao cao kao, beyond the basement to hell khao khao"
5369," For the sake of Kakao, Blackpink collapsed as if it were calling, through the floor and down to the basement"
5370,"The reason why cacao is moss Eggplant excellent company Neiva is moss. Let's do our best, let's survive"
5371,Credit counter-trafficking report
5372,Waiting for one full purchase hahahaha
5373,"10 million won The average is 10,000 won. How do you ride a water crane? There are only bullets ㅠㅠ"
5374, let's all die
5375,Cherokee-hyung In a situation I've never seen before hahahahahahahahahahahahahahahahahahahahahahahahahahahahahahahahahahahahahahahahahahahahahahahahahahahahahahahahahahahahahahahahahahahahahahahahahahahahahahahahahahahahahaha
5376,"Only the chairman resigned yesterday I'm sorry the reporter sold the mobility Then I got caught trying to sell it, but it's very different."
5377,Naver is definitely cheaper
5378,"If you use credit as an advertisement, and that is also bullshit on YouTube, wake up the stock price."
5379,"ㅋㅋㅋㅋㅋㅋㅋㅋ Just by looking at the burnout rate of foreigners, think about why there is a difference between Naver and Kakao"
5380,"There are four people playing go-stop, and if three are sloppy, can you handle it? How do four people hit a go-stop? there will be"
5381,"It's only a sigh, but when I don't know about stocks, I don't like myself a year ago, who invested a lot of money by believing in the advice of people around the stock market. I will never buy stock again until I die. If I can recover even the principal amount, I will think of it as a huge amount of life study tuition."
5382,"I'm gradually recruiting Hogu, so think carefully."
5383," Current financial market risk factors are heightened anxiety in the presidential financial market Risk factors are open to the public Pro-US-Japan policy of priority escalation of conflict heightened geopolitical risk Unverified and biased personnel Unverified personnel leaked semiconductor technology to the United States Non-compliance with Kim Gun-hee’s promise to exclude activities Yes, the standard interest rate is"
5384,He said that he sells Kakao Taxi and he sells it because it doesn't seem like it will be listed anymore.
5385,"I'm the head of the cherry blossom office, the head of the head of the office, I'm sorry, I don't knit it when I was four years old. Yes, the head of the cherry blossom, head, is a dog to me right now. The person is Mara, so I might be a little bit wrong. I'm going to tell you to keep buying in those chapters. I'll post it right now to go go go right now. Director Im now sell the house in the group chat room, sell the land, and all the loan credits are still ringing. Yesterday, the ID who said I need ID pants finally threw herself into the Han River. It's a really sad story about losing cherry. How should I make the most of the stock? Chief Im, no, I don't think I'm saying something like that now"
5386,When will the Jewish financial capital that left home come in? Please give me an answer
5387,"You can buy it now New shareholders, not existing shareholders, buy it and sell it for a pro profit"
5388,Roh Moo-hyun clearly said that he fell like a head
5389,"There are brainless sesame seeds to stop short selling. Only in Korea, if short selling is banned, they will be kicked out, and then more foreigners will come out. It is because of Moon Jae-in, who encouraged foreign institutions to invest in stocks, whether they are philanthropists or not."
5390,"I'm on Naver Pro, but I've also abandoned the outsiders of the car harpoon"
5391,Can't you even stand in the middle of a dog mess?
5392,"Stop the institutional decline Mid-current point Selling point Rising anxiety in the financial market Risk factors heightened conflict by the president’s public pro-US-Japan priority policy Unverified personnel with unverified ability to steer clear of semiconductor technology leaks to the United States Non-compliance with Kim Gun-hee’s promise to exclude activities Let's go, the base rate is"
5393,"It's finally bottoming out, a sideways year ㅠㅠ"
5394,Major companies such as Hyundai Motor Plan to invest trillions of dollars Kyungchang Industry Major companies such as Hyundai Motor plan to invest trillions of dollars in investment plans for major companies to be carbon-neutral
5395, Where is the source of index garbage provided?
5396,"When we fall, we fall together with Naver, but we can't climb together when we go up"
5397,"Wow, cacao rises, great Kazuah, I feel good today, Kazuah"
5398,Kakao only uses Talk lol
5399,"Also, it is a miscellaneous miscellaneous business with no performance management moral hazard It is a miscellaneous stock that only entered the ocean, not a new market, so there is no performance and no chance for a rebound."
5400,"I will sell mobility I will give up listing and sell I do not know yet I am preparing to sell, but I know the contract I have a real KakaoTalk left"
5401,"Don't Kakao It's still going to go down. It's a rotten management, but will the stock price go up?"
5402,Kakao really hahahahahahahahahahahahahahahahahahahahahahahahahahahahahahahahahahahahahahaha
5403,I will never buy this for the rest of my life.
5404,"Even at this price, you can't even rebound properly. Come out with Beom-soo and the CEO and do something."
5405,"Hello Gaekao, you are an event that has to go 10,000 won."
5406,I pray that you have done nothing so far
5407,There is no care phrase to enter again. It's a real care phrase.
5408,Oseyon while cruising on Naver
5409,"Naver is running, so let's run Kakao Let's run Kakao once let's go up"
5410,"In the United States, where the repayment period was enforced on short selling, there was a war with short selling after the Lehman incident and the case of Game Stop and Robin Hood. The government did not intervene because it violated the autonomy of the market. However, in the end, it was concluded that the short selling forces were defeated by introducing a cap on short positions, and the stock market went into normalization. Although it is not the same key currency country and the market itself is undervalued, short selling has no choice but to become a means of securing cash assets for foreigners rather than checking the bubble. This is the way it is. The recent trend is the same. Concerns were also detected during the last government, and short-selling for a limited time was banned, and the stock price at that time was successful. At least then there was a countermeasure. Is it"
5411,"If you sell a mobile, you won't make any money. The answer is to leave."
5412,"I'm crazy to get the exchange rate. I can't do a swap, but it's not a short-term problem."
5413,Let's make Tik Tok Tik Tok Tik Tok
5414,"No matter how much you look at stocks you can trust and buy, there is only Samjeon Nekao"
5415,"Since the won has risen, there is only one way for the upper limit Kane Kakao to rise and the won to fall."
5416,RpQ YouTubers are so hard to praise Kakao hahahahahahahahahahahahahahahahahahahahahahahahahahahahahahahahahahahahahahahahahahahahahahahahahahahahahahahahahahahahahahahahahahahahahahahahahahahaha”
5417,Why is this here?
5418,"Even at this price, if it doesn't rebound, it's all over. Please raise it a bit."
5419,"Let's have fun, we've packed a lot"
5420,"guy named RpQ, a YouTuber named RpQ, was confident that he wanted Kakao until year, month, and day, but in the end a guy with no skills kekeke said that around the month of this year ㅋㅋㅋㅋ There are a lot of market variables, but there are so many YouTubers who say shit like that. When the silver market goes down, the people who recommend really good stocks are really talented people, but RPIQ is a fighter, search YouTube and take a look at the broadcast. I'm going to say it's going up too. Nothing else but that."
5421,"Institutional buying limit Facing today's decline Closing Kakao Sold up to 10,000 won Long-acting comprehensive stocks may collapse at the end of the year The stock price rises when the Ukrainian war ends Sell stocks and increase cash weighting Investment in stocks All-in when the Ukrainian war ends"
5422,"look down on institutional kids lol. The KOSPI is going down anyway, but I bought and sold it. On a day like today, I'm struggling to keep it from going down. We bought and sold each other, work hard"
5423,"If you do this well, it will break. Ants, are you crazy?"
5424,"There were a lot of companies like you that disappeared in history. They ate their shareholders and their stomachs were full, and they secretly split up the profit division and created a bank despite the separation of money and industry."
5425,"Lose more. If you commit suicide, stop."
5426,"Target price Seriously target price Original multi-municipal disaster government beneficiary Kakao We've done a lot of bullshit in the past. Seeing the nuclear power plant stock rebound, we're going to hell now. How much does the stock price go up?"
5427,"Try subtracting more, it's really creepy"
5428,Foreigners took out all the dollars and the exchange rate went up. The country is not going to loose the dollar. What confidence do you have that it will stabilize in the second half of the year? Is inflation calming down and raw material prices falling?
5429,"If you tell me the appropriate price of cacao, and if the empty shell is 10,000 won after listing, the price of soaking rice cakes is 10,000 won"
5430,I thought it was right
5431,I have to play around with the gambling board.
5432,I see this in the middle of the month
5433,"If you want to melt your account, it's not a joke to buy, it's enough 10,000 won Really, there is something other than KakaoTalk It is possible to expand this and that by connecting it. Platforms and programs have grown so much that even small companies are good at it, and they make a lot of more innovative and innovative things. If you want to buy it, buy it when the value is right for less than 10,000 won."
5434,Cherry is still at the level of a new religion hahahahahahahahahahahahahahahahahahahahahahahahahahahahahahahahahahahahahahahahahahahahahahaha
5435,"I'm going to wake up in a little while ㅠ Seok-yeol-hyung, what's going on, it's really soooooooooooooooooooooooooooooooooooooooooooooooooooooooooooooooooooooooooooooooooooooooooooooooooooooooooooooooooooooooooooooooooooooooooooooooooooooooooooooooooooooooooooooooooooooooooooooooooooooooooooooooooooooooooooooooooooooooooooooooooooooooooooooooooooooooooooooooooooooooooooooooooooooooooooooooooooooooooooooooooooooooooooooooooooooooooooooooohoo"
5436,"If the exchange rate is going to go above the won, then the foreigner will fall out and the index will crash and come and die."
5437,keke Did a lot of people buy it when it was beekeeping?
