,title + body
0,"At this time, Kakao Main is swept away by Joseon. Among the dog news, the stock price is different because it is the Internet media."
1,"I get a lot of money and I'm dissatisfied with keeping the audio line open during working hours. I don't want to just lie down at home and watch. Just let me go to work. Even though the week was cut in half, I got a lot of dissatisfaction as I got the bonus and pay raises."
2,"Grandpa Yoo Young-doo is very disappointing This is a comment about Grandpa Yoo Young-doo left in the torn room Beom-soo's idiot is a scammer Watching Young-doo's broadcast and not knowing if he's a scammer If you see the comments, you're very disappointed with your grandfather. I only trust my grandfather"
3,"don't know what they're doing, but I don't know what Kim Bum-soo did. I sit comfortably and try to eat raw as an excuse for the metaverse. After I changed to Kakao's CEO, I was only satisfied with the staff. Was there any improvement?"
4,"The unwritten Yankee puppets who wanted to fight a 500-year war were originally one, but they were forcibly divided by the smiles. Jewish Yankees military-industrial complexes who said they had no tears of blood. Raw bloodlines used to run out of astronomical inventory. 10,000 people were slaughtered. The ROK Army in the form of a Yankee puppet without OPCON is illegal group offenders under domestic law, and it is the target of unification, not the main enemy. In other words, in the US diplomatic alliance friend partner, Korea is a partner that is not a friend, that is, a minion."
5,Is there still cannibal culture custom in Jeolla-do?
6,Holding company rebounds Land price rises Kazua
7,"With the coming of the month, the decline that has been going on for a long time as a Kakao shareholder is now adjusting the share price ahead of the short-term goal, and the things that have been terribly adjusted are now finishing the short-term and drawing an upward curve. This will be and it will take a long time in the future, but digital time is a karma that the world has to accept. Honey, if you are not in a hurry, you can walk all the way to the dot com."
8,"There is no word 'in Bus Token', but it is of the word that anyone knows well"
9,I wonder if you have certified that you are receiving the minimum wage for a representative
10,"High school student voting rights should be abolished. High voting rights, which certain political forces make schools political and students political instruments, should be reconsidered. According to the Framework Act on Education, education should not be used as a means to spread political partisan or personal prejudice Students must not guide or instigate students to support or oppose a particular political party or faction. It is in conflict with the Civil Act, which specifies that a person is an adult and prohibits him from performing legally effective acts alone until the age of life. As such, it is necessary to discuss the revision of laws and to come up with measures to resolve the side effects and confusion caused by the adjustment of the age of majority. It's one thing to do. Don't politicize the students. Make sure that you don't politicize the students. Make sure that you do character education so that you don't have boys. It's a reality in the education world in Korea today where a student stabs a teacher with a knife for waking him up while he was sleeping. Related Articles If this isn't the work of the left-wing superintendent of education and teaching, then minors should reconsider their voting rights."
11,"Are high school students teenagers these days? Even elementary school students drink and smoke, but it is not best to just let them vote and get rid of the youth protection law."
12,"Let's go on like this, let's go go go go go go go go go go go go go go go go go go go go go go go go go go go go go go go go go go go go go let"
13,I told you to be careful with the back of your head
14,Year-old shareholders Let's rest today and run again tomorrow
15,success failure
16,Metaverse work system Metaverse work system
17,"If you want to buy what's left in Kakao, you have to buy a separately listed subsidiary. Have you ever seen Google stocks that have been split in this way? Google doesn't Damn Kakao is doing that"
18,"They say it's going to go up to two thousand won ㅋ Now I get 10,000 won at once, but I'll make the most money with cacao so I'll be full."
19,It was cut in half. Last year's best shot was cut in half.
20,"Foreigners make 10,000 won. Expected to rise sharply to 10,000 won. Monthly rise. Strong buy. I inform you that this is a personal analysis and I am not responsible for the investment."
21,"In addition to the emergency breaking news, the Hypocrites Party and the Manjin Party and the Fatherland Party suffered a devastating local election Chuka Chuka Daejang-dong Baekhyeon-dong Seongnam, and they fled to Gyeyang because they were afraid of Bundang."
22,"Spoonful of monetization delivery, real drug lords"
23,"Goodbye, good-bye, I’m not going far. You guys are blaming me for regulating Kakao Talk, so it’s a thousand bucks to get it right. do it"
24,"company where dreams have disappeared, but now I can't even get enough of Never. I brought small and medium-sized things and made it like this, so I hope it's over now."
25,"Summary Rice prices are rice harvest season and rice prices have risen per per day despite rice plentiful. In other kitchen markets, coarse rice prices have risen per per and fine rice sold yesterday at Coarse grain and fine rice prices have risen respectively over the past day, according to Merchants, saying that mill owners aren't supplying enough rice to the market and prices could rise further if supplies don't improve, the Commissioner said in response to the question, when farmers said that farmers had He said there was no shortage of rice in the market because more 10,000 hectares of borough were cultivated. He added that most of the targets had already been achieved, he added. Moreover, by the end of the month, farmers across the country continue to bring rice from their paddy fields. He blamed traders and millers for causing artificial shortages in markets. Meanwhile, government raids across the country to control prices have not been very effective from day one, he said. A drive from the market, but most of the shops appear to be closed It began a day after ordering the action to be taken, Islamic Interior Minister Khandker Anwarul said on Sunday that some conglomerates were stocking up on rice without legal approval. Bought it and changed it to when the price of other necessities went up. Now it's a party. He said he's working really hard to cut spending but is failing, criticizing one of the country's largest rice markets Our correspondent at the market yesterday found that rice was sold for sacks per sack. Merchants said the price of sacks had risen during the week. Market owner Golam Ravani said the prices were changing almost daily, while he blamed the mill owner for this. Lee's co-secretary argued that mill owners are buying the rice at a higher price. Rice prices rose per party on Saturday, according to managing director Eun, who criticized rice prices, but farmers don't agree with the rice paddies of Rice traders blamed supply shortages in growers silver paddy prices did not rise He said he expects rice prices to drop this week as millers can produce and supply rice, and reporters from and contributed to the report."
26,"told you that Jakakao is too chewy, so it's called Naver kekekeke Naver is worth buying, but I don't buy both hahaha"
27,"Kakao stock price outlook and analysis It is an objective analysis, please do not empathize"
28,"The fun of today's compressed film is that this election was a national power operation to kill Lee Jae-myung and completely eliminate the traces of Lee Jae-myung, Gyeonggi-do."
29,"If Christmas falls on Saturday or Sunday, please designate Monday as a substitute holiday"
30,"I'm asking for the second time, the average price is 10,000 won, will your blood be dry?"
31,I'm asking the second question
32,"Summary Rice prices are rice harvest season and rice prices have risen per per day despite rice plentiful. In other kitchen markets, coarse rice prices have risen per per and fine rice sold yesterday at Coarse grain and fine rice prices have risen respectively over the past day, according to Merchants, saying that mill owners aren't supplying enough rice to the market and prices could rise further if supplies don't improve, the Commissioner said in response to the question, when farmers said that farmers had He said there was no shortage of rice in the market because more 10,000 hectares of borough were cultivated. He added that most of the targets had already been achieved, he added. Moreover, by the end of the month, farmers across the country continue to bring rice from their paddy fields. He blamed traders and millers for causing artificial shortages in markets. Meanwhile, government raids across the country to control prices have not been very effective from day one, he said. A drive from the market, but most of the shops appear to be closed It began a day after ordering the action to be taken, Islamic Interior Minister Khandker Anwarul said on Sunday that some conglomerates were stocking up on rice without legal approval. Bought it and changed it to when the price of other necessities went up. Now it's a party. He said he's working really hard to cut spending but is failing, criticizing one of the country's largest rice markets Our correspondent at the market yesterday found that rice was sold for sacks per sack. Merchants said the price of sacks had risen during the week. Market owner Golam Ravani said the prices were changing almost daily, while he blamed the mill owner for this. Lee's co-secretary argued that mill owners are buying the rice at a higher price. Rice prices rose per party on Saturday, according to managing director Eun, who criticized rice prices, but farmers don't agree with the rice paddies of Rice traders blamed supply shortages in growers silver paddy prices did not rise He said he expects rice prices to drop this week as millers can produce and supply rice, and reporters from and contributed to the report."
33,Influx of buying force on good news
34,I'm going to put the circle up and take out the herbal crab today ㅋㅋㅋㅋ
35,I entered Kakao Fighting
36,Escape
37,On the topic of I can barely stand ten thousand won
38,"You Aengdu said it's going to rise from the month of March, but it's not going up ㅋㅋ Again and again"
39,"No need to worry if the tech stock crashes, what kind of technology is Kakao Technology, a technology agent who steals the commercial area of the tech neighborhood Because it’s not enough to put a spoon in the taxi market, what kind of technology is the consignment agent market? Please"
40,ㅇㅇㅇ These are the textbooks of companies. People who don't have a vision. They don't have any technology and they don't.
41,Is it now
42,The collapse is something like Naver's minions Always falling a lot more than Naver Always a little bit better than Naver Nothing is better than Naver Suck my shit for the rest of your life
43,One full buying opportunity today hahaha
44,In a very fucking sport like sulphur
45,It doesn't feel natural to drop it now.
46,Maybe someday I'll go upstairs in Falcao
47,"First place when it goes down on Naver, last place when it rises"
48,"I don't have a lot of basic stamina. If the NASDAQ goes down a bit, I just hit it lol. Stop splitting it up really."
49,Short covering Tongjeong floor
50,"Let's buy in installments, this amount is cheap, let's buy it quickly"
51,What is it that the rebound can't even be done?
52,What is this? It's okay.
53,This is because of YouTube.
54,It's a short sale restaurant.
55,Monday Kakao food delivery starts ㅅㅅ Today Kakao food delivery release date ㅅ It's the Kakao Picker opening day.
56,"Aigoi, let's see"
57,"Kakao employees are full. People outside are envious of Kakao employees. They complain. There has been a saying for a long time that if you treat your servants well, you will not know your boss."
58,"Don't give me a week, don't give it to strangers at a cheap price."
59,"I get tired of waiting for it to exceed 100,000 won any time."
60,I feel like it will roll up in the afternoon haha
61,"Don't give me a week. If you buy stock, take it with you. Cacao goes up if you have it. Keep it until the end."
62,"What is the person who pays a membership fee of 2 million won? Naver KEPCO Kakao Bio Farm, which is recommended"
63," If you put it on, you will become a crooked dwarf. Take it off now."
64,I want it hahahahahahahahahaha
65," Besides, if people gather, they become distorted and dwarfs. Get rid of those people now."
66,"Stop mopping the ants, let's go up, roll it up quickly and lift it up"
67,It has begun. Today is the day to record a legend.
68, Gazah
69,The effect of Yoon Do-ri's election is over keke The scalability is over. The jerks are over. Kakao said it was not attractive because it was a representative physical division company. They said that scalability is life. Have you given up on it or will you become a shareholder-friendly company? Are you going to become a company crazy about gifts through a complex governance structure to lay a foothold for the three management?
70,You still haven't received your paycheck.
71,"You have to follow Naver, go go go"
72,"Naver is not the master of beekeeping, Kakao is not the leader of beekeeping, but why is it saying that you buy it on YouTube, so if you buy it, it will never go up and the leader is Cheonbo RNF EcoproBM. Go and look at the charts."
73,cacao will be fine
74,Kakao Fighting Let's cheer up today and ride the upward trend.
75,He doesn't seem to have a way to revive. Is the owner's limit coming out? It's almost a garbage company.
76," Dog, fuck, stop, let's go up, this garbage, if you want it to go up just a little, go for a short sale."
77,It is a valuation that can be justified under the assumption that high growth rate of Kakao's five major business divisions is maintained.
78,"It's been on Naver since a few days ago, so I haven't bought it yet."
79,Don't compare with Naver. Naver is listed here and there like Kakao and it looks like a window to sell your body.
80,"Don't be noisy anymore, let's go up, let's all join forces and climb up"
81,"Calm down, is this guy who says he's going to be late? Is he kidding you? Put it up quickly in a situation where it has to double. Don't just think about filling your stomach."
82,"Critics' play starter is down, but I can laugh"
83,"Ah, I can't even breathe"
84,Evacuate to King God Hawk Naber
85,"Yoon Seok-yeol raises Joo Joo, who is Gae Kao’s last vocalist. Does that make sense?"
86,The half cacao is going to rise anytime soon.
87,"The stock market targets are too high, they have been bitten, and they have to escape."
88,"I ask for the third time, the critics are full. My blood is dry. I am thirsty. Is it possible to escape within the moon?"
89,"They're still encouraging me to say I'm a young owl, but it's a super ant, so I just take billions of monthly memberships"
90,"The size of the market is returning to before the spread of the new coronavirus Corona as the initial public offering of the preliminary listed companies with the smallest total for the first time in years is shrinking. According to the Korea Exchange, the total amount of public offerings of newly listed stocks in last month was counted as 100 million won, which is the smallest since last month's won in the early stages of the spread of the corona virus. The public offering market this year is on a gradual downward trend. With the listing of Energy Solution at the beginning of the year, the domino public offering was expected to be successful, but the market has been shrinking for several months. The industry has cited the delisting of Daeeos as the first reason that the public offering market has entered a cooling period in the first half of this year. OneStore tried to enter the KOSPI, but withdrew because the competition rate for institutional demand forecasting did not meet expectations. He explained that the stock price of companies has been sluggish since the listing and explained that the trend of more conservative analysis of profitability and growth potential is strong in the process. According to Anta Securities, the total operating profit forecast for this year of Kakao Bank, Kakao Pay Krafton, an energy solution listed in 2018, was downgraded from KRW trillion in the beginning of the month to KRW trillion in the month. If the downward revision of the operating profit forecast for Korea continues, the uncertainty felt by investors about the newly listed companies will increase. However, the market stagnation is expected to continue for a while as preliminary IPO stocks are delaying the IPO in consideration of market conditions rather than efforts to set the IPO price. The issue is that Socar Curly Oasis K-Bank and others postponed their listing schedule, and a drought is expected in the public offering market in the second half of the year. He said that if he subscribes to individual investors before making a decision, he can review the needs of individual investors as well, so an appropriate public offering will help him decide."
91,"Good power, naver power, grab even a good hair and follow it"
92,Naver Bohap
93,"The reason why Naver is better is the reason why Naver is more popular Hello, I love you Neiva Neiva"
94,"If it comes to 10,000 won, I'll buy it."
95,Kakao is no longer listed as a subsidiary Don't go public with Kakao Don't let Kakao do business. I'm a shareholder of Kakao. Pay Kakao properly.
96,"It's a big deal for black cows who can't even read financial statements. Compared to the peak, Naver has lost less."
97,Naver fighting
98,"It looks like we're almost here, let's go one-way from tomorrow"
99,"Go a little like a red light on Naver, at least lol"
100, Grandpa Yoo Young-doo Grandpa Sang Seo Young-doo Grandpa Has any of the things you said about Kakao been right since last month? What is the reason for continuing to broadcast on YouTube that causes countless ants to suffer with irresponsible and pointless content? Thank you for refraining from YouTube broadcasts that make you cry.
101,"Let's go up quickly, there's only time left for the closing price. Let's go up quickly."
102,I make a suggestion to the CEO of Kakao. Change the name of the Daum portal to Kakao. Then I will use Kakao instead of Naver.
103,It broke and I couldn't get over that ㅠㅠ
104,"Large-cap stocks fair value 3 cheonsei KRW 10,000 Eljeon KRW 10,000 Hynix KRW 10,000 Kakao KRW 10,000 Samsung KRW 10,000 LG Chem KRW 10,000 LG Ensol KRW 10,000 Celltrion 10,000 KRW Samsung Biologics KRW 10,000 Shinhan Financial Group KRW 10,000 Finance KRW 10,000 Korea Electric Power 10,000 KRW Telecom 10,000 KRW LG Innotek KRW 10,000 Samsung Electro-Mechanics 10,000 won Samsung SDS 10,000 won Samsung Life 10,000 won It's my second year of stock experience, trust me hehe"
105,Today's closing price
106,Let's blow one shot at the last minute. Today's closing price is won.
107,"Jurin, who I don’t even know, pretends to know a lot, but you don’t know better than analysts’ analysis."
108,"Kakao is the only system in Korea that only Kakao can do because it is implemented based on the Kakao App, an innovation of the short-distance delivery logistics system, and can build an infrastructure without a lot of investment cost using the advantages of the national app. The amount of money is huge. You can see that Coupang is losing trillions of dollars every year. No one can jump in easily, but Kakao has solved this problem. Become a delivery driver Let's assume that there are 10,000 Kakao drivers in the country Every day, huge commissions will be captured by Kakao sales The infrastructure is already laid out with the National Kakao App."
109,Kakao Acquisition Kinemas sales ceiling Flying good investment information-Kinemisty-World's first platform World's first good news announcement Investment information World's first good news announcement
110,The speed of going up is slow. How long does Naver have to follow?
111,The holy land of ants Why do they come in? There is no dividend.
112,"I opened my mouth and shit came in, I lost my hand lol"
113,It's skyrocketing after hours.
114,Buy it today
115," Kakao is not KakaoTalk, but it has a mother. Oh, I also got KakaoTalk because it was pushed by the previous government."
116,"Hey, there was Chewhojae today, but why didn’t it go? Everyone was accustomed to it. Food delivery starts today, but why is the stock price in Chewhojae?"
117,Overwhelming payment service Naver Tospay Internet bank also overwhelmingly wins Toss Bank Kakao Bank is a piggy bank Main savings account facts everyone knows
118,target price
119,Kim Bum-soo splits the company and should stop listing the toilet paper trading affiliates More Kakao affiliates than Samsung Kim Beom-soo’s strategic affiliates listed
120," Oh, you're a dog owner."
121,Is the director receiving the minimum wage?
122,"What is it? The short selling balance is running hot every day, but the short selling balance is gradually decreasing. Last Friday, I hit Manchuria or short sellers, but the balance actually decreased. Where did the difference come from? hell hello"
123,"The downhill road is in ascending order, now it's a mental fight"
124,Is the upper limit covered today hahahaha
125,"Gatkao Dag Someday, the flight is already starting. Let's fight. We plan to purchase additional shares in the future."
126,often
127,"Gwajwa-dong, Incheon My mother is Gye-in Lee, Yeongsun-gu, Yeongsin-gu, My-Cheon, Gaja-dong, Incheon, Sophie, Saeil Shopping, Lee Boo-jeung, Bo-jong-nim, Korean-Chinese, Yanbian, Jin-hee, Makka-yeon-man, Ah Busa Su-Kik-Kik Tic Symptom Severe purchase unit price payment manipulation Cell phone wiretapping hacking Exploitation from monthly welfare center goods Yearly premium payment Severe vagina"
128,I said Naver rather than Gerba Kakao haha
129,I said Naver rather than Gerba Kakao.
130,It's hard to get going this year even if you do it hahaha It's enough if you eat short-term profits ㅋㅋ
131,Let me show you once in a while.
132,"If Christmas falls on Saturday or Sunday, please designate Monday as a substitute holiday"
133,Acquisition completed before today's floor
134,I'm crazy because I'm short covering.
135,Kakao is over.
136,My brother tells me
137,You guys are bound to be robbed anyway
138,Is the dark age of cacao over?
139,I sold all the cloth miscellaneous goods and made cacao
140,"Without Big News, it can't go up because of short selling."
141,"Please help me, this is the floor, give me a chance to escape"
142,I'm going to fall for something like this again ㅋㅋ Awake
143,Prelude to Reversal
144,"I'm asking for the fourth time. My blood is dry, please."
145,"If it fell, I pursued it, and if it lost money, I continued to pursue it, and now it is a profit ㅋㅋ Today is strong. Let's go to the floor this month."
146,The high point is garbage cacao p
147,Automotive Semiconductor Uniquest Pro operating profit increased compared to last year Automotive Semiconductor Uniquest Professional operating profit increased compared to last year
148,Let's buy quickly Let's go up in the future Let's buy more quickly quickly Let's get water quickly
149,katok and katok
150,"Kakao Go Go Let's go to the upper limit today Let's buy a good feeling and let's get into the water, fighting"
151,"Let's make a pillar of fire If we can't make a red pillar of fire on the front line today, our efforts to rise in the past few days will be in vain. Foreign institutions, please come in."
152,"Selling at Naver's high point, it came over before cacao oil."
153,It's always the same pattern I'm uploading it today to take a plunge
154,"Please save me, I just want to do the floor plan"
155,It sold well at Naver High Point.
156,Let's go up fast let's go up
157,Ofro okakao is full of energy today
158,Oh yeah haha
159, You've definitely penetrated the front line. I'm going to at least the circle. Hold onto it.
160,I know cacao is over
161,"Hahahaha I thought I was going to send it three days ago, but it was actually cacao hahaha"
162,Foreign institutions should buy doubles and come to the upper limit as soon as possible.
163,"ㅠ I’m here now, let’s go, Kakao"
164,"I'm going to eat a good deal of credit. Credit only. I'm afraid when the irrational Morgan comes in. If it goes up a bit more, the principal will be restored. I'm afraid, so I'll have to pack some bullets."
165,"Hold up to 10,000 won, take a little more, not sell a single share"
166,"It's the first floor, when will you come?"
167,reunion speech
168,let's go let's go let's go
169,Crazy cacao with no sense of inspiration
170,Now is the best price.
171,I bought treasury stock.
172,These guys are so cute today.
173,"Ride fast, get wet quickly"
174," Buy Next week Sell next week, I buy next week"
175,I am worried about whether to sell it or not to sell it for a million won.
176,Let's go to the prize hahaha
177,"The reason for today's rise is because of the opening day Kakao is trading at 10,000 won, up from the previous day, as of the morning of the same day. It has been net buying 10,000 shares in four days until today. Kakao traded up to 10,000 won per month last year, but its share price fell to 10,000 won last month and halved. U.S. tech stocks, which had been selling on the possibility of a speed control, poured money"
178,"I feel good today, I'm looking forward to it"
179,Do you make a ham-bokki holiday? The days are good and the holidays are long. Stir-fried ham
180,Do you have a lot of people above the critique?
181,Selling from reviewers to reentrants to SakyanidaI
182,I'm trying to be asymptomatic or I'll come out with materials
