,title + body
1677,"The major shareholders are playing with the major shareholders, and the dividend is not even the price of a candy dog. Who wants to buy it?"
1678,I'm wide open in the circle Come quickly haha
1679,Basic salary is not even funny ㅠ
1680,"Waiting for entry when 10,000 won"
1681,"The cause of the stock price collapse is Seok-Yeol Yoon, who is ready for war in the unfavorable global financial market, so foreign investment left and Korean-style Trump collapsed this week."
1682,"Cheer up, if Yeongdu Camping Du sells, buy it"
1683,"Be strong, Demon King. But cacao never goes up ㅠ ㅠ"
1684,"Fur is not even hungry anymore, let's go down now"
1685,Where did the cherry go?
1686,"Although cacao has fallen a lot, it is still highly likely that it will fall more than a year ago when it was in the low 10,000 won range. Although we have fallen close, I think this will not be the end As it has reached a big peak, it may fall in the next year or year. It sometimes goes down over the past year or more Ant investors who have suffered a sudden crash after wearing it are not likely to see it easily, and it is cheap and easy to buy, but they will know what it means later."
1687,"Even if you follow the installment purchase, you will survive. Be sure to remember that there is a basement under the floor."
1688,I'm digging a tunnel. Is there a gold mine underground?
1689,"Why is the current stock market crashing? I’ve been talking about why the stock market is going down now. I’ve been talking about it since a year ago. The disaster government has listed hundreds of trillions of new public offering stocks such as Kakao Krafton and LG Energy Solution through a public offering. You know, it's the same principle. Money is limited in the stock market, but it's not even ten trillion won, it's natural for the stock price to crash when hundreds of trillions of won are newly listed. If you sold stocks and institutions were added, it would be over a trillion. So how can the stock market survive? Even if the US recovers, the Korean stock market is difficult. Newbies in stocks don't know that. It has always been and is still the same"
1690,"If you hold it for a year, it will recover. Don't worry too much."
1691,"Because the president is well elected, the stock price is going well haha"
1692,"Korea failed, the election was wrong"
1693,"It's a miracle that you don't go to the lower limit on a day like this, you'll be blessed"
1694,It gets worse as time goes on. Are you going to turn all the shareholders into beggars?
1695,I'm from Samjeon keke Let's go see cacao and heal. Thank you.
1696,"The Democratic Party must expel all those from the activist movement The Democratic Party must expel all those from the activist movement In the 1980s, long live the great leader Kim Il-sung, Kim Il-sung, I love my father, swore allegiance to Kim Il-sung and wrote a bloody oath of allegiance to the Republic of Korea communism movement and the election democratization movement. The nation must get rid of them all They are activists within the Democratic Party. The Democrats deny North Korea's acts of terrorism and do not attend the ceremony to commemorate the Dacheonan that unconditionally made the North Korean side. It's the fault of Lee Myung-bak. The foolish instigated people know that the Democratic Party was a democratization movement in the 1990s. Tell the facts. The Democratic Party activists moved to communism in Korea in the 1990s. Even today, the teachers of all teachers created by these movements tell our children that Kim Il-sung, the national hero, Kim Il-sung, is the greatest on the Korean Peninsula. teaching people"
1697,Totally tasted it
1698,Jaewook Jung is calling. Goodbye. Goodbye. My precious person was happy.
1699,It's a pity that Hong Jun-pyo's promise was to abolish short selling.
1700,"It’s still far away, but the price isn’t coming, but it doesn’t break haha The price has come and it’s enough."
1701,Let's share with the ants who lost their nose hair and property loss.
1702,What other excuses will cherry make? I live on my own as a self-proclaimed president.
1703,"Mr. Yeom shouted to buy at the half price of cacao, but as expected, Mr. Yeom is super super-super goofy ㅋㅋ He's got a lot of ants to get promoted and get a job ㅋㅋ He was shouting to buy most of the three-time Hynix Eljeon cacao ㅋㅋ He's super-savvy Mr."
1704,I have to go in now to get revenge.
1705, I'm Yuengduda It's been fun in the meantime. Now go back to your main job and work. Come back when you earn money.
1706,Is it a big deal if you hear Mr. Mr. Mr. Yeom? There are several types of ants bites.
1707,"You should have listened to Mr. Lee from Money Today. Those of you who heard Mr. Yeom were bullied by Mr. Yeom ㅋㅋ As expected, Mr. Lee is right."
1708,Elliot wave statue should be full. Elliot wave is waiting. Wave of fear. You will see hell.
1709,legend
1710,Do you just want everyone to die? Kakao is the most mistaken thing I've ever done in my life.
1711,"You have to listen to class leader Lee. Mr. Yeom is an ant stinger, and class leader Yi gives advice to the ants."
1712,"If you have been in the water recently, please get on the water before you get on the water and change your opinion. If you get on the wrong water, the damage is bigger like a snowball."
1713,"In the afternoon, the index is falling further."
1714,Breaking news Hanging in line
1715,"It's on the floor, so what should I do?"
1716,Short sellers are complaining about sitting on a cushion today
1717,No million-dollar growth
1718,"The future of Kakao is gloomy Among the large groups, the rate of use of Facebook Messenger is higher than that of KakaoTalk as a communication tool. Pemehae is more familiar than KakaoTalk. According to WiseApp, an app analysis company, KakaoTalk has the highest share among domestic messengers, but it continues to In addition, the monthly Facebook usage time of billions of people is much higher than billions of people of other age groups"
1719,"It went up from the circle, so it's serious that it's going back to the same place again"
1720,"The share price is 10,000 won Simple paperwork is possible First, the par value is the same as the stock split, the stock is issued free of charge again per share Issued Kakao Coin and paid out to Kakao shareholders for free"
1721,"No one has been bitten by this, but let's see the fair price of a garbage company"
1722,"I've been told not to touch Kakao, a political theme since last year ㅋㅋ A company that grew up with institutional privileges through hard licking of shit by the left-wing government is an innovative cosplay lol"
1723,Jew cherries keke Do you eat rice? You know Jisoo that Warren Buffett doesn’t even know kekekeke My cat is smiling.
1724,"Everyone who buys stocks, bonds, options, and coins without me"
1725,"If you go professional with a single stock, you are guaranteed to lose. Sell at a loss every time it rises."
1726,I almost caught a falling blade
1727,I've completely sent away all the cherries. Bad cherries
1728,Khao Ganda ruined it ㅜㅜ
1729,It's too expensive right now.
1730,"It's a review, it's amazing"
1731,"Individuals buy them, so just leave them alone when the winter falls. How far should you go? When you have a lot of money, you go away when you have a lot of money. You’re so picky about it."
1732,Chairman Yoo Young-doo’s emergency strategy distribution pack The strategy that only paid members know is a strong buy.
1733,I said I'm going to hell when the government changes
1734,It's ruined
1735,A small business sucking company hahahaha
1736,It's coming this week.
1737,"If you stop buying before the 10,000 won break, you will be beaten. A clear bear market will continue until the end of this year or next spring. If the 10,000 won breaks, you can make a plan to buy it. I wonder where the gamblers will hear it, but last month, I told you to sort out all the stocks and just take a look."
1738,It will be talked about in a few years
1739,It's good to be Yoon-san's president hahahahahahahaha
1740,"What the hell are people who buy this? Of course, Kakao has stakes in other subsidiaries, but it's different from direct investment and investment by filtering one cushion."
1741,"The biggest risk Korea's biggest risk is that it's a country of drinkers and call girls who have no interest in politics, economy, culture, education, welfare policy, philosophy, or knowledge."
1742,There is nothing wrong with what the elderly say
1743,Explosions like cherry hahahaha
1744,"Where is the floor? I got water in the garden today, but the shabaltto falls off?"
1745,"Who is it who said that only this stock is unbreakable ㅋㅋ I said it clearly It will be coming soon in the beginning, there is nothing to be urgent"
1746,Won week's new low today
1747,Main jwa cacao horo grandmae soup rice of boiling ant soup
1748,There is no end to the decline.
1749,"I made a stop loss and put in savings Last Thursday, I made a stop loss, took out the deposit and put it into a savings bank term deposit, but if I put it in for a year, will the loss be recovered quickly?"
1750,Was there a war with this?
1751,There is no way to merge everything that has been split or not.
1752,I've been watching
1753,The best bad news still remains: Kakao Gugul's withdrawal angle Google just dump Kakao Kakao Koreans will defend it haha Kakao Google's exit means that it will not be able to advance into the Korean market in the end.
1754,Shows the end of a dog dirty stock
1755,"I lost my stop and put in savings, if I survived, I passed it on"
1756,"You have to come out now, all the money is gone"
1757,Kakao floor event stock price I am high contest
1758,How far do you take it? Is there a floor?
1759,"Raise your hands, the assholes who bought the price of the die. Politics can't win the public sentiment. The academic economy can't beat the market. Look at the world market now."
1760,"Only those who have money, take good time. The things you don't have are missing. Walking prices High oil prices."
1761,"It's all because of Yoon Seok-ryeol, who is a senior in the stock market. I told him not to choose him like that. The Korean economy will retreat for a year. Of course, the stock will also go to the KOSPI a year ago."
1762,Let's all die ㅋㅋ Let's gather at the Han River
1763,"If you have a rating of 10,000 won so far, that's great. I don't know where the stock is bottoming, but it's scary these days."
1764,"I open my mouth for 10,000 won, my heartbeat"
1765,"I bought it when it was 10,000 won, I took it off when it was 10,000 won, but I didn't know how to see it."
1766,"When the million is gone, take it"
1767,Moon Jae-ang Donghak ant instigation result ㅠㅠ I should not have followed the mood ㅠㅠ
1768,"More trees will burst, so hold on."
1769,"Hahahahahahahahahahahahahahahahahahahahahahahahahahahahahahahahahahahahahahahahahaha to buy cacao. After the bubble is over, the ants keep saying that they live more and more. They keep falling. Cheers between the ants."
1770,We are talking about a long-term recession in the US and European markets. This phenomenon will last until early next year.
1771,"Poop, let's make a good value investment after blowing all over the floor"
1772,bouncy bouncing
1773,Is it okay if I hit it here?
1774,"wrote this when it went to 10,000 at the beginning of the month. I am sure it will be 10,000 units this year. I am sorry for the shareholders with the highest number of views, but the chart is like that. ㅡㅡㅡㅡㅡㅡㅡ Forgive the comments that only go to Bichugae, and always be humble in the market"
1775,"I'd rather buy Celltrion Hanmi Pharm. Kakao's fair value is 10,000 won."
1776,Cherry Blossoms Sara Sara Sara Sara Sara Sara Sara Guards Sara Quiet Quiet Quiet Angel Room and Nabal. Is it enough to just suck money? Do you think of other people?
1777,Purchase of Tea Purchase of Tea Full Purchase of Tea
1778,Just go and spread the money.
1779,"Growth stocks do not use their strength in a trending downtrend A long-term recession is coming, but it is still a long way off."
1780,"Kakao is a vicious company. You know, a vicious company."
1781,"Today only ㅋㅋ Tomorrow is ㅋㅋ Three generations ago, people say that I live with all my fortunes, so it’s a real bummer."
1782,"Moon Jae-in, Blue House Democratic Party Kakao Gate Special Prosecutor Moon Jae-in The Blue House Democratic Party is the decisive reason that Lime Optimus Yoo Si-min and Chu Mi-ae went crazy and killed Yoon Seok-yeol and Han Dong-hoon, the chief of civil affairs, and Han Gong-hoon, who were not cooperating with their crime cover-up, especially from the private equity fund of the motherland. Moon Jae-in, the main culprit of the next kakao macro, who said his country’s private equity fund can’t stop his dog poop and won’t settle through fixed bonds Shenyang social enterprise doesn't talk Stop it, a year left. Even now, the Democratic Party must admit the crime, pay the price and ask for forgiveness The circumstances of the collusion are so visible that the privatization of Kakao Gate for whose benefit is the high valuation Durable eat-and-run privatization. The main culprits are the Democrats, who are the main culprits, who are the main culprits of corruption and corruption for lifelong food."
1783,Is only cacao open mouth from the cloth?
1784,I would like to express my condolences to the stock murderer condolences. This is just the beginning.
1785,"Finally, we meet in ginsengchi. Taste the hotness of the Maxim machine gun. Money lost because of the Donghak ant."
1786,"After imitating a YouTuber, I go to the goal. After all, I am an expert, a YouTuber, and I don't need it all. In the end, I have to become skilled."
1787,"Oh U dropped last week's recommendation, so if large stocks fall, it's a buying opportunity haha A lot of people must have been bitten"
1788,"The spring day is gone, the old days, the day that will never come again"
1789,It is a place that will not come again because the children who climbed a lot even during the net rise of the coin stock real estate in the lower rankings released their funds due to the Corona virus.
1790,"It is the price of Seok-yeol’s choice. Stocks crash. Stocks plummet during the previous regimes Kim Young-sam, Lee Myung-bak, and Park Geun-hye. Stocks fell. Kim Dae-jung, Roh Moo-hyun, and Moon Jae-in. Stocks rose. Roh Moo-hyun. It's even worse. Kakao has been on the brink of collapse since he was elected in May."
1791,"If only messenger appears instead of KakaoTalk, the company does not pay the real value of the stock and the paper price."
1792,"Don't get caught up in mangkao, just sell it and buy another stock so that should recover quickly."
1793,"Today is the bottom Buy today, wait, sell, and get your pocket money You're always going to die. This point was the bottom."
1794,"Masters, should I get water?"
1795,Why are you carrying toilet paper?
1796,Let's go up now. It looks like everyone has sold out. Let's go up now.
1797,"If you open the plaster to be put on, it will plummet even more. Goodbye"
1798, Information before target price adjustment Closing price target announced Current price target price
1799,I finally went down today. Think about knitting it soon. You can knit it for a long time.
1800,"For a company to have an appropriate market cap now, even if growth potential is taken into account, operating profit should come out at a low level."
1801,Are there any hogus who haven't escaped yet?
1802,This is the price of chicken
1803,"Haha I rode water today, why did oil prices and natural gas fall?"
1804,"If it is a big step by the Fed tomorrow, it will rebound as expected, and if it is a giant step, it will be hell again."
1805,"The share price is now at the bottom, and there is no choice but to be careful with the split purchase."
1806,"Even if interest rates were raised to a low level, it was plentiful."
1807,"Kakao is now a holding company because Kakao is a holding company, so why are you buying this? They are saying that Samsung C&T is going up because they sell Samsung Electronics semiconductor smartphones well hahahahahahahahahahahahahahahahahahahahahahahahahahahahahahahahahahahahaha Still, it's better to go to Samsung C&T as a dividend payer, but a holding company that doesn't pay dividends is not attractive."
1808,Intensive purchase of Hyundai Bio's program for outsiders with a focus on interest Monthly urgent approval is possible.
1809,"have my mouth wide open in In, I am attached to it, I risked my life in In, I made it with a hundred million water, and last week I sold all of it when it rebounded."
1810,"It can be expected, and it's a miserable reality."
1811,"Just say it, believe it or not"
1812,"US Inflation Rate Highest in Years KOSPI Records Year-Round Low The KOSPI broke through the mid-day low in the aftermath of the US inflation rate hitting its highest in years. In the stock market, institutional investors and foreigners are each net selling 100 million won, while individuals are net buying billions of won alone. Samsung Electronics at the top of the market capitalization has pushed back to a new low of 10,000 won Samsung Electronics The stock price of Naver and Kakao has been on a downtrend as concerns about an economic slowdown and uncertainty about the semiconductor industry have been highlighted recently. In addition, Naver and Kakao also broke new record lows at the beginning of the market. In addition, Energy Solution Hynix Samsung Biologics Chemical Hyundai Motor Samsung, etc. At the same time, the KOSDAQ index recorded a point drop compared to the previous trading day. At the same time, the KOSDAQ index recorded . The stock market plunged in the aftermath of the US consumer price index hitting a new high. The US Labor Department said on the same day that Wall Street rose compared to the same period last year. It also surpassed journal experts' expectations and the previous month's level. Markets are even predicting that the Federal Reserve could take a giant step in raising the benchmark interest rate by one point at the monthly Federal Open Market Committee meeting to be held on the next day. As concerns that the stock market might strengthen, the Nasdaq index plummeted on the previous day, and the New York Stock Exchange and the major indices all fell at once. It is acting as a burden, and this is a negative factor for foreign supply and demand. Kiwoom Securities analyst Han Ji-young added that while waiting for the reel, the domestic stock market will continue to expand volatility as it was adversely affected by the monthly event of a surge in the US consumer price from the beginning of this week. Although a sell-off is occurring, considering the attractiveness of entering the stock market and good earnings prospects, it is appropriate to respond while waiting. He said that he predicted that the downtrend would continue until the first half of this year even if there is a relief rally for the technical rebound of the KOSPI, he said. He added that he believes that even concerns about an economic recession caused by reaching higher than the interest rate have been partially reflected in the Seoul foreign exchange market."
1813,"If the stock bubble was my post months ago, he was really right. So I'm going to increase my cash weight or make a down bet. YouTube stock broadcasting has ruined the national account."
1814,"It's a stock explosion, you bastard"
1815,There are still people who stock stocks without knowing that the quantity of short sale is infinite.
1816,"CEO Bum Soo-rang, come out right now, this is not the time to be stuck."
1817,"I can't help it, blame the finger of the person who took the picture"
1818,"In the current situation, is it ok to buy at the current price? Hahaha I’ll be there sooner or later lol"
1819,"The fall of the gap cannot be a big shock. If the bottom is at the bottom, the bottom is supported, pushed slowly, or stopped at the bottom. To say that the top stocks are becoming like this, Samsung Electronics has a heavy market capitalization, so it is slowly being pushed aside. Naver and Kakao are just sent away in one shot. You can tell just by looking at Kakao, the support point of the double bottom. The new low price update due to a drop in the breakout gap. This one lasts a long time. It will take a really long time for the gap drop to fill up. Also, there is no guarantee that an additional crash will not occur. If the KOSPI breaks down, the Nasdaq will follow again. If the collapse was really big, I would try to make the shape of the double floor, but that's not it, and it's pushed out tremendously. By this point, I'm really done"
1820,Yoo Young Duchumae
1821,Don't buy rashly.
1822,"Downstairs is open, holding the liver ring Underground Life Jikbang"
1823,"Now, let's climb. The time is up. Let's go up quickly with all our last strength."
1824,Valid to buy Kakao Chinese Money
1825,Kakao is a company that dominates the media and gets stuck in politics and misses the backs of ordinary people
1826,Samsung Samsung Must-Spec. We eat together.
1827,I'm just starting from this idiot
1828,"Kakao changes into a stinky image Kakao News Comments on Kakao Sword Call Girl Shrimp Habitat If you write a word like this, you get a permanent stop. When I look at cacao these days, there is no answer"
1829,There is no way to bail out those who are in debt
1830,"The last water ride, water ride stocks don't know the power to go up and down after putting money on money."
1831,"Kakao Risk Gakao News If you comment against Gakao, you will be permanently suspended."
1832,Kakao Cheonwon Aegari Ziuk
1833,"The ants are not defending, so it would be nice to have a short sale as the ants take it all ㅋㅋㅋㅋ Sell it high and pay it back later"
1834,"Let me tell you a strange story hehe I had the experience of selling at the highs and buying at the lows. Of course, it was not at the highest point, but at some high point. I sold it in Samjeondo, and Hyundai Motor was about 10,000. Anyway, why did they sell at that time? I felt strange that when I sold all the stocks, that was the high point. But it didn't fall right away when I sold it from the high. What happened after that? There was an additional rise after that. And then the stock market crashed. You can think of it the other way around. The sound of the shooting bottom of the downward force is coming, so I sold it because I thought it would fall further. Of course, the downward shot may come out bigger, but I saw that LG's raw material has bottomed out to some extent haha I think the time of the stock market going up is getting closer."
1835,"Why are all the stocks like this today? Daeshin Securities also plummeted, Kakao is not surprised, Macquarie also went down. What day is it today?"
1836,Everyone please go out I want to be alone Oh ㅆ F Give me my money.
1837,"Why is the country going bankrupt? Why is it that only Kakao is going down? Not only Kakao, but all KOSPI stocks are going down. Even when it doesn't sound like it's sounding a warning sound like a peaceful voice, suddenly a certain author gave a news briefing and the reality is that there is a lot of divergence in reality."
1838,I'm a close friend of all-selling but ten-thousand-thousand-forth short selling
1839,"Tonight too, it's a catfish bite anyway"
1840,Long live Jo Cao
1841,"To be honest, I'm curious as to what the minus percentage is for those who can stand it."
1842,"It's been a while since I came in, and no matter how much I went to the US market, the international situation KOSDAQ KOSPI didn't rise compared to the US market. Bystander is really hot"
1843,It's only in the beginning of this week hahahahahahahahahahahahahahahahahahahahahahahahahahahahahahahahahahahahahahahahahahahahahahahahahahahahahahaha
1844,Why don't you increase your employee's salary by the amount you lost? It's simple.
1845,Thank you
1846,"Come on, make a plan for this week"
1847,"Even if I do, I am prepared to endure it, but it is too much of a miscellaneous stock."
1848,"I got used to it and bought it again, but I got bitten again haha"
1849,"Looking at the moonbong, it doesn't look like anything fell. Looking at the moonbong, it looks like a healthy rowing lol"
1850,"Suka World Last year, it was broadcast saying that it was hard to say that the manager of the border crossing Suka World was also bitten, and he must have stopped losing."
1851,"The baby is dirty, it is broken in half, there is no money to spend, and the feeling is strong."
1852,It's skyrocketing after hours.
1853,"The car support line is 10,000 won. The car is 10,000 won."
1854,"Go to sleep, go to sleep, Gaarai, here you go, take care, this is your last chance to escape."
1855,"No morals, no sense of responsibility"
1856,"Well, if you subtract a little more, you can subtract about half more"
1857,"Because of the difference, the Republic of Korea has become a chaotic country. You have to work harder for the next year or two."
1858,Stocks that only short sellers make today
1859,"I feel like I'll be pushed to ten thousand, but if I can't lose even in a thousand"
1860,"When it comes, I go in. I'll come in soon."
1861,"Chinese capital, Mina, profit realization Ange Kakao It's going to go down for a while."
1862,It's a real bargain. Buy high-quality stocks in times like these
1863,"The 10,000 won is also overvalued, but the handset is cacao, dogs and soda are placed on the table, and the ants wash the dishes."
1864,"Kakao 10,000 won Samsung 10,000 won The more of the two"
1865,"It's coming soon. If it's a little late, it's going to be a disaster. What if it spreads like this?"
1866,Expected to fall tomorrow
1867,"Somebody says it's pounding every day, but it's really falling apart."
1868,It's so funny that Indue's rattling is falling hahahahahahahahahahahahahahahahahahahahahahahahahahahahahahahahahahahahahahahahahahahahahahahahahahahahahahahahahahahahaha
