,title + body
3368,"The reason I sold at the beginning of today is that when interest rates rise, cash is a safer asset than stocks and bonds. The dollar will remain strong, and the value of Korean money will continue to fall. The easiest way to own real estate is to depreciate the won, which inevitably causes the dollar to appreciate and the real estate price to become relatively low. You can't avoid this. The value of cash goes up. Put simply, now is not the time to make money with stocks, it's time to hold cash or dollars."
3369,"Let go of regrets I still can't get rid of regrets and hold. Kakao went up a lot because of the Moon Jae-in administration, and now I'm off the bus. The next year won't go up."
3370,Hahaha garbage stock market
3371,"Kakao is not a technology growth stock, just a holding company"
3372,The comedian is just laughing hahaha
3373,only remember memory
3374,"If you support it with a single hit, let's put a little"
3375,Coming soon to Mando Global Panic
3376,It is the fate of stocks that fall as if attracted to the natural law of gravity.
3377,"I'm afraid I'll fall, no, I'll have to call someone"
3378,That's great. It's a great stock.
3379,Uple Kakao Mobility vs. Hojae
3380,Awesome again
3381,"I am looking for a cherry tree that has gone home, please report it"
3382,"Fuck Nigimi, just let me shut it down. How is it going down?"
3383,"Even the fair value of 10,000 won was generously given."
3384,"Why is it okay to bite cacao, better than being bitten by a tiger?"
3385," Take it easy because it's no money, because it's really no money."
3386,Daughter of Han Dong-hoon's Daughter False Volunteer Activities A girl from the future ㅋㅋ Minister Han Dong-hoon's daughter even signed her own voluntary service in the future. Is this the girl who leapt through time? It comes out that Han Dong-hoon's daughter personally signed that she has completed monthly volunteer work. Kakao shareholders: Kakao collapsed as soon as I pulled out the seats for this.
3387,"The US interest rate will be raised every month, but the stock price is going to crash"
3388,"If it's a normal Democrat speculator, it's 10,000 won when washing the dishes. The Democrat government will sell it in a short sale, but you didn't know it was taken advantage of ㅋㅋ"
3389,I'm afraid I'm going to have only a minus stop loss.
3390,Hey- Jokao- What are you doing?
3391,It's a complete mess. I only got bitten by this guy.
3392,"I don't even have a day to raise it. I want to be the top stock in the KOSPI. If it's true, it's Kakao Coin."
3393,GaGao's name will come true
3394,"If it's not steady today, there will be a shooting"
3395,"ㅆ ㅣ P I know that car, I'm very tired of that carton stock I'm so fed up with that carton stock I have to delete all the money and delete all the cacao so it disappears within a year That carton cacao I will never see that carton again in my lifetime close the door"
3396,Especially today ㅠㅠ I hate Yoo Young-doo ㅠㅠ
3397,It's too much to mess around with. I'll get my money back.
3398,s
3399,Dog kaoh real dog tte
3400,The members seem to want to beat the cherry blah blah blah blah blah blah blah blah blah blah blah blah blah blah blah blah blah blah blah blah blah blah blah blah blah blah blah blah blah blah blah blah blah blah blah blah blah blah blah blah blah blah blah blah blah blah blah blah blah blah blah blah blah blah blah blah
3401,"This is the main stock of Bunchung, but somehow it fell."
3402,"Did you make a contract, sell the house, collect the only ones, and see all the dirty things in the world?"
3403,He's been licking shit for a few days lol.
3404,"If Samsung gets everything, Kakao will be 60,000."
3405,I climbed up coolly in the morning and this is why I feel so bad Why is the stock this way I want to recover the principal quickly and float
3406,"My Gung-hoon doesn't get a salary, so he's pissed off, so he's doing his job every now and then."
3407,"Blue light every day, no answer"
3408,"Jurin and Judgment Morgan puts it, but the gangsters drop it and the ants don't live, so Morgan will be pissed off, so I'm going to lose my hand today or tomorrow."
3409,"Eyes and tears, tears are flowing down"
3410,The minimum wage for CEO Pak Pak is not even worth it.
3411,opening ceremony ad
3412,I warned you in the morning not to buy or sell
3413,This is the first time for such a dog-like stock.
3414,Weekly option expiration date. Can you upload it today?
3415,"If Jung Eun shoots a nuke, let's catch it for 10,000 won"
3416,I'm leaving I can't stand it anymore I'm going with tears in my eyes
3417,"The cherry blossom disappearance case keke Was he really an expert? The scammer said it would never break, and the Jewish financial capital himself said it would never be broken. I'm an expert"
3418,"The size of the counter trade was 100 million won, the highest level in months. As the KOSPI fell to the line for consecutive trading days, the worries of Donghak ants who invested in debt are deepening. According to the Korea Financial Investment Association, the amount of counter trades compared to receivables from consignment transactions was counted as billions of won as of the previous day. This is the highest level in a month since 100 million won. In the year before the Corona crisis, the monthly counter-trading increased almost twice compared to the 100 million won on the day the most occurred. When the borrowed money is not repaid within the agreed maturity period, it refers to a transaction in which a securities company forcibly sells and disposes of the stock regardless of the customer's will. In the case of a bank account that is not repaid within this period due to the repayment period, or when the collateral value falls below a certain percentage, the securities company arbitrarily conducts counter-trading. Overdue interest must be paid on the outstanding amount after counter trading The amount decreased from last month to month, but increased again from month The KOSPI and KOSDAQ indices both broke their new lows on the last day. The KOSPI ended the market on a point drop from the previous trading day. It was below the reference line. Although the speed and KOSDAQ indices are rebounding, there is still anxiety in the domestic stock market amid fears of inflation. While counter trading is on the rise, the balance of credit loans to invest in stocks with debt is also not decreasing. Considering that it was only in the trillion won range, it means that it has nearly doubled."
3419,Mmmmmmmmmmmmmmmmmmmmmmmmmmmmmmmmmmmmmmmmmmmmmmmmmmmmmmmmmmmmmmmmmmmmmmmmmmmmmmmmmmmmmmmmmmmmmmmmmmm
3420,"Welcome, it's my first time to sit in the front seat tomorrow"
3421,Call the cherry right now hahaha
3422,Today's won weekly record lows won consecutive rounds down
3423,Entering the lower floor keke It's still a long way ke Repurchase allowance from the floor keke up for the plunging keke plunging fighting keke
3424,Ooyalako because I used young bean sprouts
3425,"KakaoTalk One-tool for domestic use Only those who don't use KakaoTalk should throw stones at Kakao. It's ridiculous. It's ridiculous that a company that uses it for an application topic that's annoying to change because other people use it for a messenger topic that has neither innovation nor merits, is making fun of a company that pays fees with it. The future of the company is obvious The executives are obnoxious and the CEO is fleeing overseas."
3426,"I robbed the counter-trading, the ants were tired, and the short sale won the public market."
3427,How many times do I say it's more serious than the Rubo incident lol It's only natural to climb endlessly and get down again when you reach the top.
3428,"From ten thousand to ten thousand people, even ten thousand times, I was griffy, but I can't hear it even if I talk about it for ten thousand times."
3429,I'll try it tomorrow
3430,"My hyung, I'm here, you must be in a lot of trouble."
3431,What floor are you on? The air here is so thin that you can't even breathe. What floor are you on?
3432,"I have condolences from the former, please drop by when you have time"
3433,Don't pay attention to me once in a while
3434,"It was said that it was a day and night Changsha in Edo, but will it disappear even now?"
3435,"Kakao Enter Kakao Mobile spin-off, there are still big ones left ㅋㅋ Going further"
3436,"Characteristics of each section of the average unit price More than 10,000 Kakaon but less than 10,000 Nursing care Guarantee more than 10,000 Yes I did not fall over 10,000 Hogu I think I bought it at a good price ㅋ No no, I picked up the bottom."
3437,"When you wake up, send a notification to the entire company through KakaoTalk."
3438,Why is the CEO of Kakao a pig? Why is the CEO of Kakao so bloated? They say he is a monk who eats roasted meat.
3439,"Is this President Kim Kun-hee's ex-boyfriend company? Can't you ask your second president of the Republic of Korea, Sir Kim Kun-hee, to raise the stock price a bit, even if you see the old relationship?"
3440,I need to prepare for the car drop. Let's go.
3441,go to hi-mart
3442,I'm going to go through this again and again hahahaha
3443,"It's pathetic, what kind of company is doing this after posting it"
3444,"I'm going all-out, but the charters are going to be negative because of my critique."
3445,It's a big deal. Be careful. Kospi is coming.
3446,It's really serious
3447," Generation buy above Kakao is the fear of capitalism. Young friends Ryan or Muji. I bought this because I am used to it. The owner of this company does not focus on enhancing shareholder value, but removes the crown jewel to make a pocket, and sells stocks only If you ask me if it's the bottom of what I've been doing, it's the lowest point I've been doing, so if I can't keep it, everyone thinks that, so it's kept at this price, and it's flowing because the people who notice it popping up It's a stop-theft technology. Don't do it, save a lot"
3448,"Seok-yeol-ah, what are you doing these days? There is an old saying that a person who will do well starts with the cotyledon. What are you doing now? Please come to your senses and pay attention to the economy. 👌👌👌👌👌👌👌👌👌👌👌👌👌"
3449,Cherries Why are you not broadcasting these days? Are you robbed? You know what crime you have committed. A bat-like guy who only takes money and spends a lot of money.
3450,"Yoo Ungdu is the highest point, but it's full, but I need a mental evaluation. The members who follow it, I gave up. People who can't do anything."
3451,"wonder why it keeps falling like this, but I don't know if it's when I'm crazy about stocks with money around the world There may be a short-term rebound, but in the end, it will be enough to reach the 10,000 won level."
3452," KOSPI interest rates are coming soon, so those who are keen to sort things out by themselves Minutes on foot from Gangnam Station Super station area Roombay Perfect apartment type Last dedicated apartment in the Gangnam area Price per pyeong of less than 100 million Apartment sales right Inquiry"
3453,"Hey, I really don't want to manage the stock price. Let's do well."
3454,"Victory in short selling in the horror market Seungri, foreigner What are the comments that you expect to rise in this market? I already ate it as a counter sale, ate it as a short sale, and ate it as a private sale again. Picking up only foreigners all day. Attempts at the point of no meaning are over"
3455,"I must have seen the beekeeping, but the decline is creepy"
3456,Yaaaaaaaaaaaaaaaaaaaaaaaaaaaaaaaaaaaaaaaaaaaaaaaaaaaaaaaaaaaaaaaaaaaaaaaaaaaaaaaaaaaaaaaaa
3457,Han Dong-hoon's daughter Volunteering activities for a girl from the future Minister Han Dong-hoon's daughter even signed her own volunteer work in the future. Is this the girl who leapt through time? There was an autograph saying that he had completed his volunteer work in . Donghoon's daughter's autograph hahahahahahahahahahahahahahahahahahahahahahahahahahahahahahahahahahahahahahahahahahahahahahahahahahahahahahahahahahahahahahahahahahahahahahahahahahahahahahahahahahahahahahahahahahahahahahahahahahahahahahahahahahahahahahahahahahahahahaha”
3458,It's skyrocketing after hours.
3459,"I should have chosen my religion well, but it's a pity that I fell for the pseudonym."
3460,When are you going to buy your own shares?
3461,Recovery sucks.
3462,Ten thousand won share ㅜㅜ I've seen it before ㅜㅜ
3463,Kakao Monthly Trading Trend Kakao Monthly Trading Trend Trading Volume Manchuria Exchange Rate Won Program Net Buy Short Sell Manchuria During the Manchuria Market Individual Manchuria Net Sell Foreign Manchuria Na Solo Net Buy Institution Manchuria Net Selling Pension Fund Daily Manchuria Net Selling Private Fund Manchuria Net Selling Securities Manchuria Net Selling Investment Manchuria Net Selling Insurance Manchuria Net Selling Insurance Manchuria Dalrang net purchase Other corporations Manchuria net purchase
3464,I'm a nerdwhhhhhhhhhhhhhhhhhhhhhhhhhhhhhhhhhhhhhhhhhhhhhhhhhhhhhhhhhhhhhhhhhhhhhhhhhhhhhhhhhhhhhhhhhhhhhhhhhhhhhhhhhhhhhhhhhhhhhhhhhhhhhhhhhhhhhhhhhhhhhhhhhhhhhhhhhhhhhhhhhhhhhhhhhhhhhhhhhhhhhhhhhhhhhhhhhhhhhhhhhhhhhhhhhhhhhhhhhhhhhhhhhhhhhhhhhhhhhhhhhhhhhhhhhhhhhhhhhhhhhhhhhhhhhhhhhhhhhhhh it's too late.
3465," big correction comes after the rise of the KOSPI trend A big correction comes after the rise of the KOSPI Report sympathy and dislike Report a big correction comes after the rise of the KOSPI The biggest investment after a rise in the trend is to take a break. In the 1980s, after the year of the month, the year of the rise, the year of the rise, the year of the rise, the year of the rise, the year of the rise, the year of the rise, the year of the rise, the year of the rise after the year adjustment of the Lehman crisis The year of the rise after the bankruptcy of Lehman Brothers The year of the corona I can't distinguish between when to invest and when to rest, I'll leave the market in the end Always hungry people ride the last train Now there is no time for new money to come in From now on, the liquidity market is over Composite indices and large-cap stocks are tied together and rotated down Small-caps Mid-caps Large-caps It comes down to the bottom in turn, and then when large-cap stocks come down, it makes the bottom of the composite index. Then there comes a sell-off. Since it is the bottom when only the moans of ants are heard, it is predicted that the next chapter will start after the years have passed. Adjustment and period adjustment came in. After that, individuals became his natural culling. If the mountain is high, the valley is deep. Rest until the bottom comes, and rest and rest, and then only increase losses. Countless days have to pass until the next chapter comes. Do not ask questions unconditionally, do not ask questions, and rest is investment. If you look again, the bottom will automatically go back then. Did you make a lot of money by listening to people? You have to ask the stocks to find out. Even if you don't go, it's not right. They're all useless slogans. Rest is the biggest investment"
3466,"It was a red pillar in the morning, but why did it rain in the afternoon and it ate and splashed?"
3467,"While the bubble is falling, the executives have already sold and devoured it."
3468,"Putin Sooner or later, nuclear war is inevitable There is a Russian independent media outlet, General, on social media Instagram on the same day, revealing a conversation between Putin and some of his aides. While discussing the prospects of the term, he reported that he said that a nuclear war is inevitable sooner or later and that if a nuclear war breaks out, we must be prepared to strike a decisive blow first."
3469,"The pension fund, which is said to be a long-term investment, has sold all its supplies for a month. Is the country taking the lead in making the ants poor?"
3470,"As much as the hive, only the shell remained as the bubble stock cacao octopus was listed."
3471,"Jeolla-do, a beneficiary of the Moon Jae-ang government, is bursting with corporate bubble"
3472,"The out-of-town is also missing, so tomorrow's market will be better as it's a professional out-of-town bar."
3473,"Even if the purchase comes under 10,000 won, the market cap exceeds the trillion won."
3474,For the record of pilgrimage to Kakao Manganda
3475,Shinpoong Pharm gave me a chance to escape. What is this?
3476,"The secret of Han Dong-hoon's daughter's volunteering time ㅋ Minister Han Dong-hoon's daughter even signed her own voluntary service in the future. Is this the girl who leapt through time? It was signed that the activities were completed, so Donghoon is signing his daughter hahahahahahahahahahahahahahahahaha"
3477,Kakao is like a world of lepers
3478,I slept tomorrow
3479,"Cherry Blossom hyung said, “Tomorrow, I’m going to buy it. I’m going to buy it again and again,” from “pak pak pak pak pak pak pak pak pak pak pak pak pak pak pak pak pak pak pak pak pak pak pak pak pak pak pak pak pak pak pak pak pak pak pak pak pak pak pak pak pak pak pak pak pak pak pak pak pak “"
3480,Unexpected futures open and fall
3481,"Youngsoo's mom, I'm here, I'm going to start tomorrow"
3482,"Ryu Young-joon After falling into a messenger miscellaneous business, the billionaire Young-jun Ryu, who sold everything he wanted to talk with the homeless, kicked the CEO of Kakao and devoured it, is the real one."
3483,Is there something going on in the domestic market? The drop is huge with the volume of out-of-country trading. Bitcoin also went up and then plummeted again. It seems that something is popping up. Almost all stocks are not very good.
3484,"Well, it's delicious, but the graph is very pretty hehe I'm so glad you guys are having a hard time"
3485,"Shin Won-geun Shinwon buy 10,000 shares of KakaoPay’s representative company Listen to the news Text size print Share responsibility management Total size of about KRW 100 million Other management plans to purchase this month He declared that he would receive only the minimum wage without receiving any compensation."
3486,"Realistic way of escaping right now, in all categories, near the main shrine, there is nothing more than the main temple, and when it comes, I don't look back even after losing my contract and open my eyes to sell. Won Won Won Won Won Won, Won, Won, Won, Won, Won, Won, Won, Won, Won, Won, Won, Won, Won, Won, Won, Won, Won, W Because one of them is a huge resistance, it is rather difficult to rebound than a waterfall Psychological state, so the possibility of escaping in the short term as you go up the corpse level is almost as high as the only way is to get wet in such a case It is a short-term mechanical rebound, but I know from experience that it is not the same as my own evaluation It will be a lot of experience ㅎㅎ Even if you ride the water, you have no choice but to lower it."
3487,Narak Gazah Han River a
3488,bottom of the chart
3489,Everyone expected that Adura went into Wednesday's closing price and that the systematic risk of selling this morning was zero. It was also expected to rebound at the beginning of today.
3490,It's torn in half.
3491," It's okay, it's real, it's done"
3492,All stocks are falling as intercity trading volume explodes.
3493,Your customer.
3494,"The person who was cut in half Raise your hand, is it really there?"
3495,I know why it falls. All objects fall according to the law of universal gravitation.
3496,"How about one thousand shares? Should I spend money without stocks and bury it, or should even half of it be rescued?"
3497," Tomorrow's plunging Large-cap stocks one after another Cross-country sell-offs Now, U.S. futures are plunging, sell quickly"
3498,The Han River is cold.
3499,"If you're going to give it a go, it's really Halanabune's North Korean nuclear test, it's a very clever thing haha"
3500,"Finally, the 10,000 won season that I was talking about is slowly coming, but you can accumulate until the 10,000 won profit goal Absolutely won't go above 10,000 won in a year."
3501,"Securities company report If you believe in the target price and invest, Kakao is promising Kakao proves that. When it rose to 10,000 won last summer, many securities companies did not raise their target price to 10,000 won. Go ten thousand won ten thousand won hahaha"
3502,"If you go to the Won, how much KOSPI will fall. Will you really push the Won to the Won like a dog? How much will you earn if you push that much?"
3503,"Oh, that's really cool. Blue light"
3504,Nasdaq's biggest drop in history Only on Bloody Friday
3505,"It went back to the stock price a year ago. The sales and operating profit almost doubled compared to that time a year ago, but the price was the price at that time."
3506,Tomorrow will experience a more plunging market than today
3507,Kikio is a good company that will eventually fly beyond recovery
3508,Nuclear war. Now the stock is over.
3509,"I thought I'd buy it today, but I didn't buy it because it was annoying"
3510,The goal is to change from khao to khao haha
3511,"Korean stocks are falling for the time being. US interest rates are going to rise again next month. Sell cacao stocks, sell short, and buy again from the lows."
3512,know why it's falling I sold it last year and saved up. I should buy it next year at an interest rate of more than a pro
3513,Reply to deleted posts
3514," Weak ants, the weak and weak ants today have lost their heads"
3515," According to the Japan Travel Japan Duty Free Shop Hana Tour, the number of Japanese package reservations for the past week has increased compared to the month of the month of parking, and the number of reservations has increased recently."
3516,The million-dollar shooting is real.
3517,You gave me a big present in the US Be glad that you got a big present haha
3518,"got it in my brain for once, no, I don't know what will happen in the future ㅠ I'll have to catch it again mo ㅠ"
3519,You need to use your credit properly
3520,The reward is great
3521,"Replying to the deleted post At the single price at the end of the day, the first hitter was scrambled."
3522,Hahahaha Lee Yang-ban is fine
3523,"Seeing you fall into Europe, I'll be awake tomorrow"
3524,"If there is a war going on, buy a gas mask if you don't want it."
3525,This is before the closing
3526,I don't think it's worth going up a lot of this kind of event. You have to go up a lot too. Don't become a long fight bug. Don't you know if this category is heavy?
3527,Please note that this event will continue to be dropped amid the economic downturn.
3528,Looks like she's in the middle of a beauty job
3529,Yoo Young-doo is innocent. Investment is solely his responsibility hahahahahahahahahahahahahahahahaha
3530,"Oh, I'm sorry, it's only sold at a single price, but I'll break it"
3531,"It's a pity that the sound of the song against the trade on Thursday is at the highest level. The sound of the song against the trade on Friday will also come out. If it's Friday, it's hard to say that you didn't reach the high point. It's heartbreaking. It's sad reality"
3532,I have a hard time eating antibiotics. I need to earn a few pennies to satisfy my hunger even if it is raw ramen noodles.
3533,I do not know where the floor is. The flat is full. I need to know from where the floor is compacted and crossed for a long time. I do not know how far it falls.
3534,"It looks expensive compared to the high, but it is an optical illusion. It is still overvalued compared to the low."
3535,Chairman Yoo Young-doo went to the Day of Loss of Loss
3536,You can buy it when it comes
3537,I still can't stop losing my share.
3538,"You know that there are no ads on KakaoTalk, meta is living off advertisements. Look forward to the moment when an advertisement appears on KakaoTalk, which dominates the messenger market."
3539,Reply to deleted post Real Recall Girl Alias Ms. Ms.
3540,I really want to go for a million dollars
3541,"If you get a multiplayer, it's an appropriate platform company, so you hit a lot."
3542,"Chairman Yoo Young-doo has lost his hand. When the beekeeping comes out, he goes on YouTube."
3543,Putin's hack Putin's hack is rumored to be a rumor lol
3544,The Yankee Hounds of the Republic of Julie were the ones who massacred the natural cry of opposing the division of the nation with the red flag. This practitioner was the only Yankee puppet-type Koreans without OPCON should know the shame
3545,I used to be a member of the Boram family and then I got it
3546,How much more do you want to subtract?
3547,I'm going to go out of town tomorrow kekekekekekekea Chuka Chuka See you on YouTube and people who write credits at the Han River
3548,More than a million average people are still alive
3549,"He only picks up foreigners. Poor ants, I told you not to trust me, but I'll fly it in a day. It's good. It's going down because of you."
3550,The fair price is coming closer
3551,"Expected to enter the historic 10,000 won level tomorrow Please confirm the low of the 10,000 won range this year"
3552,"These days, the big players in the market are foreigners and institutions, and even they are passive, but even the ants earn candy and get lost."
3553,"In the news, when Kakao Shinser promotes it, I say thank you and buy it. Kakao is the stock representative enough to be covered in the news. Naver and Kakao recently advertised to keep buying. Hahaha I know after a while"
3554,Dividend Won Is the real story? Where do you spend all the money you earn? Shareholders treat it as ten won
3555,good bye hello
3556,"Today is the last day, you will get used to it soon."
